<?xml version="1.0"?>
<!DOCTYPE Report
[
<!ELEMENT Report (General ,(Doc|BPT)) >
<!ATTLIST Report ver CDATA #REQUIRED tmZone CDATA #REQUIRED>

<!ELEMENT General ( DocLocation ) >
<!ATTLIST General productName CDATA #REQUIRED productVer CDATA #REQUIRED os CDATA #REQUIRED host CDATA #REQUIRED qcserver CDATA #IMPLIED qcproject CDATA #IMPLIED SolManSolutionId CDATA #IMPLIED SolManProjectId CDATA #IMPLIED SolManTestPlanId CDATA #IMPLIED SolManTestPackageId CDATA #IMPLIED SolManUserInfoData CDATA #IMPLIED  >

<!ELEMENT BPT (DName,Res,DVer?,TSet?,TInst?,NodeArgs,AdditionalInfo*,Doc*) >
<!ATTLIST BPT rID ID #REQUIRED >

<!ELEMENT Doc (DName,ConfName?,Res,DVer?,TSet?,TInst?,RunType?,DT?,AdditionalInfo*,Step*,DIter*,Step*,Action*,Doc*,Summary?,TestMaintenanceSummary*,NodeArgs?) >
<!ATTLIST Doc rID ID #REQUIRED type (Test|BC|BPTWrapperTest|Flow|Group|Action) "Test" productName CDATA #REQUIRED BCIter CDATA #IMPLIED >

<!ELEMENT RunType ( #PCDATA )>
<!ATTLIST RunType fmStep (False|True) "False" batch (False|True) "False" upDesc (False|True) "False" upChk (False|True) "False" upAS (False|True) "False">

<!ELEMENT DName ( #PCDATA ) >

<!ELEMENT ConfName ( #PCDATA ) >

<!ELEMENT Res ( #PCDATA ) >

<!ELEMENT AdditionalInfo (AdditionalDataName,AdditionalDataValue ) >

<!ELEMENT AdditionalDataName ( #PCDATA ) >

<!ELEMENT AdditionalDataValue ( #PCDATA ) >

<!ELEMENT DVer ( #PCDATA ) >

<!ELEMENT TSet ( #PCDATA ) >

<!ELEMENT TInst ( #PCDATA ) >

<!ELEMENT DIter (Step*,Action+,Summary?,NodeArgs)>
<!ATTLIST DIter rID ID #REQUIRED iterID CDATA #REQUIRED>

<!ELEMENT DocLocation ( #PCDATA )>

<!ELEMENT Action (AName,AIter*,(Step|HtmlStep|Action)*, Summary,ActionMaintenanceSummary*, NodeArgs ) >
<!ATTLIST Action rID ID #REQUIRED>

<!ELEMENT AIter ((Step|HtmlStep|Action)*,DataMapping?, Summary?,NodeArgs) >
<!ATTLIST AIter rID ID #REQUIRED iterID CDATA #REQUIRED isCountable (False|True) "False" >

<!ELEMENT AName ( #PCDATA ) >

<!ELEMENT TestMaintenanceSummary (ActionMaintenanceSummary*) >
<!ATTLIST TestMaintenanceSummary ObjectsAdded CDATA #REQUIRED ObjectsUpdated CDATA #REQUIRED StepsUpdated CDATA #REQUIRED StepsComments CDATA #REQUIRED><!ELEMENT ActionMaintenanceSummary (ObjectChange* ) >
<!ATTLIST ActionMaintenanceSummary Action CDATA #REQUIRED Objects CDATA #REQUIRED Updated CDATA #REQUIRED LinesTotal CDATA #REQUIRED Added CDATA #REQUIRED LinesUpdated CDATA #REQUIRED>

<!ELEMENT ObjectChange  (Hierarchy, PropertyChangeList* ) >
<!ATTLIST ObjectChange Operation CDATA #IMPLIED OriginalRepository CDATA #IMPLIED>

<!ELEMENT PropertyChangeList (PropertyDef*) >

<!ELEMENT PropertyDef (OriginalValue, NewValue) >
<!ATTLIST PropertyDef PropName CDATA #REQUIRED OriginRegularExpression (True|False) "False" NewRegularExpression (True|False) "False" AddedProperty (True|False) "False" >

<!ELEMENT OriginalValue ( #PCDATA )>

<!ELEMENT NewValue ( #PCDATA )>

<!ELEMENT Hierarchy  (ObjectName, Hierarchy*) >
<!ATTLIST Hierarchy MicClass CDATA #REQUIRED>

<!ELEMENT ObjectName  ( #PCDATA ) >

<!ELEMENT Step (Obj,Details,Time,TimeTick* ,(Step|HtmlStep|Doc)*, DataMapping?, NodeArgs) >
<!ATTLIST Step rID ID #REQUIRED retval CDATA #IMPLIED>

<!ELEMENT HtmlStep (HTML,TimeTick*,(Step|HtmlStep|Doc)*,NodeArgs) >
<!ATTLIST HtmlStep rID ID #REQUIRED >

<!ELEMENT Obj ( #PCDATA ) >
<!ATTLIST Obj plainTxt (False|True) "True">

<!ELEMENT Details ( #PCDATA ) >
<!ATTLIST Details plainTxt (False|True) "True">

<!ELEMENT Time ( #PCDATA ) >

<!ELEMENT HTML ( #PCDATA ) >

<!ELEMENT Disp ( #PCDATA ) >

<!ELEMENT TimeTick ( #PCDATA ) >

<!ELEMENT DataMapping ( DataMappedItem* )>
<!ELEMENT DataMappedItem EMPTY >
<!ATTLIST DataMappedItem dsName CDATA #REQUIRED >
<!ATTLIST DataMappedItem rowId CDATA #REQUIRED >

<!ELEMENT NodeArgs (Disp,TopPane?,BtmPane?,ExtendedInfo? )>
<!ATTLIST NodeArgs eType CDATA #REQUIRED icon CDATA #REQUIRED nRep CDATA #REQUIRED UserNote CDATA #IMPLIED filter (False|True) "True">
<!ATTLIST NodeArgs status (Passed|Failed|Done|Warning|Information) "Done">
<!ATTLIST NodeArgs iconSel CDATA #IMPLIED nType CDATA #IMPLIED MovieMarker CDATA "">
<!ATTLIST NodeArgs Source CDATA #IMPLIED SourceLine CDATA #IMPLIED StepFlowItemKey CDATA #IMPLIED >

<!ELEMENT TopPane (Path)>

<!ELEMENT BtmPane ( (Path|WR)?,ASHilite?)>
<!ATTLIST BtmPane vType CDATA "HTML">

<!ELEMENT Path ( #PCDATA ) >

<!ELEMENT ASHilite ( #PCDATA ) >

<!ELEMENT WR ( #PCDATA ) >

<!ELEMENT ExtendedInfo ( StepData ) >

<!ATTLIST ExtendedInfo StepType CDATA #REQUIRED>
<!ELEMENT DT (NodeArgs) >
<!ATTLIST DT rID ID #REQUIRED>

<!ELEMENT Summary (Param*)>
<!ATTLIST Summary sTime CDATA #IMPLIED eTime CDATA #IMPLIED passed CDATA #IMPLIED failed CDATA #IMPLIED warnings CDATA #IMPLIED retval CDATA #IMPLIED stopped (False|True) "False" >

<!ELEMENT Param (ParamName,ParamVal)+ >
<!ATTLIST Param paramInOut (In|Out) "In">

<!ELEMENT ParamName ( #PCDATA ) >

<!ELEMENT ParamVal ( #PCDATA ) >

]
>
<Report ver="2.0" tmZone="India Standard Time">
<General productName="HPE Unified Functional Testing" productVer="14.03" os="" host="DESKTOP-93RL9S9"><DocLocation><![CDATA[C:\Keyword driven folder\Driver\Driver]]></DocLocation></General>
<Doc rID="T1"   productName= "HPE Unified Functional Testing"  >
<DName><![CDATA[Driver]]></DName>
<Res><![CDATA[Res33]]></Res>
<DT rID="T2">
<NodeArgs eType="Table" icon="2" nRep="4" filter="False" >
<Disp><![CDATA[Run-Time Data Table]]></Disp>
<BtmPane vType="Table" >
<Path><![CDATA[Default.xls]]></Path>
</BtmPane>
</NodeArgs>
</DT>
<DIter rID="T3" iterID="1" >
<Action rID="T4">
<AName><![CDATA[Action1]]></AName>
<Step rID="T5">
<Obj plainTxt="False" ><![CDATA[Transaction]]></Obj>
<Details plainTxt="False" ><![CDATA[Transaction "Transaction" started.]]></Details>
<Time><![CDATA[29-03-2022 - 14:04:16]]></Time>
<TimeTick>1648542856</TimeTick>
<NodeArgs eType="Transaction" icon="5" nRep="8" nType="Start Transaction" Source="Action1" SourceLine="2" >
<Disp><![CDATA[Transaction]]></Disp>
</NodeArgs>
</Step>
<Step rID="T6">
<Obj plainTxt="False" ><![CDATA[SystemUtil]]></Obj>
<Details plainTxt="False" ><![CDATA[SystemUtil]]></Details>
<Time><![CDATA[29-03-2022 - 14:04:37]]></Time>
<TimeTick>1648542877</TimeTick>
<Step rID="T7">
<Obj plainTxt="False" ><![CDATA[Run "C:\Program Files (x86)\HPE\Unified Functional Testing\samples\Flights Application\FlightsGUI.exe",1]]></Obj>
<Details plainTxt="False" ><![CDATA[Run "C:\Program Files (x86)\HPE\Unified Functional Testing\samples\Flights Application\FlightsGUI.exe",1]]></Details>
<Time><![CDATA[29-03-2022 - 14:04:37]]></Time>
<TimeTick>1648542877</TimeTick>
<NodeArgs eType="Replay" icon="6" nRep="12" status="Passed" >
<Disp><![CDATA[Run "C:\Program Files (x86)\HPE\Unified Functional Testing\samples\Flights Application\FlightsGUI.exe",1]]></Disp>
</NodeArgs>
</Step>
<NodeArgs eType="Replay" icon="6" nRep="11" status="Passed" >
<Disp><![CDATA[SystemUtil]]></Disp>
</NodeArgs>
</Step>
<Step rID="T8">
<Obj plainTxt="False" ><![CDATA[HPE MyFlight Sample Applicatio]]></Obj>
<Details plainTxt="False" ><![CDATA[WpfWindow]]></Details>
<Time><![CDATA[29-03-2022 - 14:04:38]]></Time>
<TimeTick>1648542878</TimeTick>
<Step rID="T9">
<Obj plainTxt="False" ><![CDATA[agentName.Set]]></Obj>
<Details plainTxt="False" ><![CDATA["john"]]></Details>
<Time><![CDATA[29-03-2022 - 14:04:38]]></Time>
<TimeTick>1648542878</TimeTick>
<NodeArgs eType="Replay" icon="8" nRep="17" >
<Disp><![CDATA[agentName.Set]]></Disp>
</NodeArgs>
</Step>
<Step rID="T10">
<Obj plainTxt="False" ><![CDATA[password.Set]]></Obj>
<Details plainTxt="False" ><![CDATA["hp"]]></Details>
<Time><![CDATA[29-03-2022 - 14:04:39]]></Time>
<TimeTick>1648542879</TimeTick>
<NodeArgs eType="Replay" icon="8" nRep="19" >
<Disp><![CDATA[password.Set]]></Disp>
</NodeArgs>
</Step>
<Step rID="T11">
<Obj plainTxt="False" ><![CDATA[OK.Click]]></Obj>
<Details plainTxt="False" ><![CDATA[]]></Details>
<Time><![CDATA[29-03-2022 - 14:04:39]]></Time>
<TimeTick>1648542879</TimeTick>
<NodeArgs eType="Replay" icon="9" nRep="21" >
<Disp><![CDATA[OK.Click]]></Disp>
</NodeArgs>
</Step>
<Step rID="T12">
<Obj plainTxt="False" ><![CDATA[HPE MyFlight Sample Applicatio.Close]]></Obj>
<Details plainTxt="False" ><![CDATA[]]></Details>
<Time><![CDATA[29-03-2022 - 14:04:42]]></Time>
<TimeTick>1648542882</TimeTick>
<NodeArgs eType="Replay" icon="7" nRep="23" >
<Disp><![CDATA[HPE MyFlight Sample Applicatio.Close]]></Disp>
</NodeArgs>
</Step>
<Step rID="T13">
<Obj plainTxt="False" ><![CDATA[SystemUtil]]></Obj>
<Details plainTxt="False" ><![CDATA[SystemUtil]]></Details>
<Time><![CDATA[29-03-2022 - 14:04:54]]></Time>
<TimeTick>1648542894</TimeTick>
<Step rID="T14">
<Obj plainTxt="False" ><![CDATA[Run "C:\Program Files (x86)\HPE\Unified Functional Testing\samples\Flights Application\FlightsGUI.exe",1]]></Obj>
<Details plainTxt="False" ><![CDATA[Run "C:\Program Files (x86)\HPE\Unified Functional Testing\samples\Flights Application\FlightsGUI.exe",1]]></Details>
<Time><![CDATA[29-03-2022 - 14:04:54]]></Time>
<TimeTick>1648542894</TimeTick>
<NodeArgs eType="Replay" icon="6" nRep="27" status="Passed" >
<Disp><![CDATA[Run "C:\Program Files (x86)\HPE\Unified Functional Testing\samples\Flights Application\FlightsGUI.exe",1]]></Disp>
</NodeArgs>
</Step>
<NodeArgs eType="Replay" icon="6" nRep="26" status="Passed" >
<Disp><![CDATA[SystemUtil]]></Disp>
</NodeArgs>
</Step>
<Step rID="T15">
<Obj plainTxt="False" ><![CDATA[agentName.Set]]></Obj>
<Details plainTxt="False" ><![CDATA["john"]]></Details>
<Time><![CDATA[29-03-2022 - 14:04:55]]></Time>
<TimeTick>1648542895</TimeTick>
<NodeArgs eType="Replay" icon="8" nRep="32" >
<Disp><![CDATA[agentName.Set]]></Disp>
</NodeArgs>
</Step>
<Step rID="T16">
<Obj plainTxt="False" ><![CDATA[password.Set]]></Obj>
<Details plainTxt="False" ><![CDATA["hp"]]></Details>
<Time><![CDATA[29-03-2022 - 14:04:56]]></Time>
<TimeTick>1648542896</TimeTick>
<NodeArgs eType="Replay" icon="8" nRep="34" >
<Disp><![CDATA[password.Set]]></Disp>
</NodeArgs>
</Step>
<Step rID="T17">
<Obj plainTxt="False" ><![CDATA[OK.Click]]></Obj>
<Details plainTxt="False" ><![CDATA[]]></Details>
<Time><![CDATA[29-03-2022 - 14:04:56]]></Time>
<TimeTick>1648542896</TimeTick>
<NodeArgs eType="Replay" icon="9" nRep="36" >
<Disp><![CDATA[OK.Click]]></Disp>
</NodeArgs>
</Step>
<Step rID="T18">
<Obj plainTxt="False" ><![CDATA[WpfTabStrip.Select]]></Obj>
<Details plainTxt="False" ><![CDATA["SEARCH ORDER"]]></Details>
<Time><![CDATA[29-03-2022 - 14:04:59]]></Time>
<TimeTick>1648542899</TimeTick>
<NodeArgs eType="Replay" icon="10" nRep="38" >
<Disp><![CDATA[WpfTabStrip.Select]]></Disp>
</NodeArgs>
</Step>
<Step rID="T19">
<Obj plainTxt="False" ><![CDATA[byNumberRadio.Set]]></Obj>
<Details plainTxt="False" ><![CDATA[]]></Details>
<Time><![CDATA[29-03-2022 - 14:05:00]]></Time>
<TimeTick>1648542900</TimeTick>
<NodeArgs eType="Replay" icon="11" nRep="40" >
<Disp><![CDATA[byNumberRadio.Set]]></Disp>
</NodeArgs>
</Step>
<Step rID="T20">
<Obj plainTxt="False" ><![CDATA[byNumberWatermark.Set]]></Obj>
<Details plainTxt="False" ><![CDATA["4"]]></Details>
<Time><![CDATA[29-03-2022 - 14:05:00]]></Time>
<TimeTick>1648542900</TimeTick>
<NodeArgs eType="Replay" icon="8" nRep="42" >
<Disp><![CDATA[byNumberWatermark.Set]]></Disp>
</NodeArgs>
</Step>
<Step rID="T21">
<Obj plainTxt="False" ><![CDATA[SEARCH.Click]]></Obj>
<Details plainTxt="False" ><![CDATA[]]></Details>
<Time><![CDATA[29-03-2022 - 14:05:00]]></Time>
<TimeTick>1648542900</TimeTick>
<NodeArgs eType="Replay" icon="9" nRep="44" >
<Disp><![CDATA[SEARCH.Click]]></Disp>
</NodeArgs>
</Step>
<Step rID="T22">
<Obj plainTxt="False" ><![CDATA[HPE MyFlight Sample Applicatio.Close]]></Obj>
<Details plainTxt="False" ><![CDATA[]]></Details>
<Time><![CDATA[29-03-2022 - 14:05:04]]></Time>
<TimeTick>1648542904</TimeTick>
<NodeArgs eType="Replay" icon="7" nRep="46" >
<Disp><![CDATA[HPE MyFlight Sample Applicatio.Close]]></Disp>
</NodeArgs>
</Step>
<Step rID="T23">
<Obj plainTxt="False" ><![CDATA[SystemUtil]]></Obj>
<Details plainTxt="False" ><![CDATA[SystemUtil]]></Details>
<Time><![CDATA[29-03-2022 - 14:10:31]]></Time>
<TimeTick>1648543231</TimeTick>
<Step rID="T24">
<Obj plainTxt="False" ><![CDATA[Run "C:\Program Files (x86)\HPE\Unified Functional Testing\samples\Flights Application\FlightsGUI.exe",1]]></Obj>
<Details plainTxt="False" ><![CDATA[Run "C:\Program Files (x86)\HPE\Unified Functional Testing\samples\Flights Application\FlightsGUI.exe",1]]></Details>
<Time><![CDATA[29-03-2022 - 14:10:31]]></Time>
<TimeTick>1648543231</TimeTick>
<NodeArgs eType="Replay" icon="6" nRep="50" status="Passed" >
<Disp><![CDATA[Run "C:\Program Files (x86)\HPE\Unified Functional Testing\samples\Flights Application\FlightsGUI.exe",1]]></Disp>
</NodeArgs>
</Step>
<NodeArgs eType="Replay" icon="6" nRep="49" status="Passed" >
<Disp><![CDATA[SystemUtil]]></Disp>
</NodeArgs>
</Step>
<Step rID="T25">
<Obj plainTxt="False" ><![CDATA[agentName.Set]]></Obj>
<Details plainTxt="False" ><![CDATA["john"]]></Details>
<Time><![CDATA[29-03-2022 - 14:10:32]]></Time>
<TimeTick>1648543232</TimeTick>
<NodeArgs eType="Replay" icon="8" nRep="55" >
<Disp><![CDATA[agentName.Set]]></Disp>
</NodeArgs>
</Step>
<Step rID="T26">
<Obj plainTxt="False" ><![CDATA[password.Set]]></Obj>
<Details plainTxt="False" ><![CDATA["hp"]]></Details>
<Time><![CDATA[29-03-2022 - 14:10:32]]></Time>
<TimeTick>1648543232</TimeTick>
<NodeArgs eType="Replay" icon="8" nRep="57" >
<Disp><![CDATA[password.Set]]></Disp>
</NodeArgs>
</Step>
<Step rID="T27">
<Obj plainTxt="False" ><![CDATA[OK.Click]]></Obj>
<Details plainTxt="False" ><![CDATA[]]></Details>
<Time><![CDATA[29-03-2022 - 14:10:33]]></Time>
<TimeTick>1648543233</TimeTick>
<NodeArgs eType="Replay" icon="9" nRep="59" >
<Disp><![CDATA[OK.Click]]></Disp>
</NodeArgs>
</Step>
<Step rID="T28">
<Obj plainTxt="False" ><![CDATA[WpfTabStrip.Select]]></Obj>
<Details plainTxt="False" ><![CDATA["SEARCH ORDER"]]></Details>
<Time><![CDATA[29-03-2022 - 14:10:50]]></Time>
<TimeTick>1648543250</TimeTick>
<NodeArgs eType="Replay" icon="10" nRep="61" >
<Disp><![CDATA[WpfTabStrip.Select]]></Disp>
</NodeArgs>
</Step>
<Step rID="T29">
<Obj plainTxt="False" ><![CDATA[byNumberRadio.Set]]></Obj>
<Details plainTxt="False" ><![CDATA[]]></Details>
<Time><![CDATA[29-03-2022 - 14:10:51]]></Time>
<TimeTick>1648543251</TimeTick>
<NodeArgs eType="Replay" icon="11" nRep="63" >
<Disp><![CDATA[byNumberRadio.Set]]></Disp>
</NodeArgs>
</Step>
<Step rID="T30">
<Obj plainTxt="False" ><![CDATA[byNumberWatermark.Set]]></Obj>
<Details plainTxt="False" ><![CDATA["4"]]></Details>
<Time><![CDATA[29-03-2022 - 14:10:51]]></Time>
<TimeTick>1648543251</TimeTick>
<NodeArgs eType="Replay" icon="8" nRep="65" >
<Disp><![CDATA[byNumberWatermark.Set]]></Disp>
</NodeArgs>
</Step>
<Step rID="T31">
<Obj plainTxt="False" ><![CDATA[SEARCH.Click]]></Obj>
<Details plainTxt="False" ><![CDATA[]]></Details>
<Time><![CDATA[29-03-2022 - 14:10:51]]></Time>
<TimeTick>1648543251</TimeTick>
<NodeArgs eType="Replay" icon="9" nRep="67" >
<Disp><![CDATA[SEARCH.Click]]></Disp>
</NodeArgs>
</Step>
<Step rID="T32">
<Obj plainTxt="False" ><![CDATA[numOfTicketsCombo.Select]]></Obj>
<Details plainTxt="False" ><![CDATA["7"]]></Details>
<Time><![CDATA[29-03-2022 - 14:10:56]]></Time>
<TimeTick>1648543256</TimeTick>
<NodeArgs eType="Replay" icon="12" nRep="69" >
<Disp><![CDATA[numOfTicketsCombo.Select]]></Disp>
</NodeArgs>
</Step>
<Step rID="T33">
<Obj plainTxt="False" ><![CDATA[updateBtn]]></Obj>
<Details plainTxt="False" ><![CDATA[Object&nbsp;is&nbsp;disabled]]></Details>
<Time><![CDATA[29-03-2022 - 14:10:56]]></Time>
<TimeTick>1648543256</TimeTick>
<Step rID="T34">
<Obj plainTxt="False" ><![CDATA[updateBtn]]></Obj>
<Details plainTxt="False" ><![CDATA[Object's physical description:<br>Text = <br>devname = updateBtn<br>]]></Details>
<Time><![CDATA[29-03-2022 - 14:10:56]]></Time>
<TimeTick>1648543256</TimeTick>
<NodeArgs eType="Replay" icon="13" nRep="71" status="Warning" nType="Description" >
<Disp><![CDATA[updateBtn]]></Disp>
</NodeArgs>
</Step>
<NodeArgs eType="Replay" icon="9" nRep="70" status="Failed" nType="Run Error" >
<Disp><![CDATA[updateBtn]]></Disp>
</NodeArgs>
</Step>
<NodeArgs eType="Context" icon="7" nRep="16" status="Failed" >
<Disp><![CDATA[HPE MyFlight Sample Applicatio]]></Disp>
</NodeArgs>
</Step>
<Step rID="T35">
<Obj plainTxt="False" ><![CDATA[HPE MyFlight Sample Applicatio]]></Obj>
<Details plainTxt="False" ><![CDATA[WpfWindow]]></Details>
<Time><![CDATA[29-03-2022 - 14:10:57]]></Time>
<TimeTick>1648543257</TimeTick>
<Step rID="T36">
<Obj plainTxt="False" ><![CDATA[Run Error]]></Obj>
<Details plainTxt="False" ><![CDATA[Object is disabled<BR/>Function file: C:\Keyword driven folder\Function Library\Library1.qfl<BR/>Line (26): &quot;   WpfWindow(&quot;HPE MyFlight Sample Applicatio&quot;).WpfButton(&quot;updateBtn&quot;).Click&quot;.]]></Details>
<Time><![CDATA[29-03-2022 - 14:10:57]]></Time>
<TimeTick>1648543257</TimeTick>
<NodeArgs eType="Replay" icon="13" nRep="73" status="Failed" Source="C:\Keyword driven folder\Function Library\Library1.qfl" SourceLine="25" >
<Disp><![CDATA[Run Error]]></Disp>
<BtmPane vType="ViewerGen.SSViewerGen" >
<Path><![CDATA[ZIP::Act1\Row0\ssf10.xml]]></Path>
<ASHilite><![CDATA[7605612]]></ASHilite>
</BtmPane>
</NodeArgs>
</Step>
<Step rID="T37">
<Obj plainTxt="False" ><![CDATA[Stop Run]]></Obj>
<Details plainTxt="False" ><![CDATA[Run stopped by user.]]></Details>
<Time><![CDATA[29-03-2022 - 14:11:36]]></Time>
<TimeTick>1648543296</TimeTick>
<NodeArgs eType="General" icon="14" nRep="74" status="Information" >
<Disp><![CDATA[Stop Run]]></Disp>
</NodeArgs>
</Step>
<NodeArgs eType="Context" icon="7" nRep="72" status="Failed" Source="C:\Keyword driven folder\Function Library\Library1.qfl" SourceLine="-1" >
<Disp><![CDATA[HPE MyFlight Sample Applicatio]]></Disp>
<BtmPane vType="ViewerGen.SSViewerGen" >
<Path><![CDATA[ZIP::Act1\Row0\ssf9.xml]]></Path>
<ASHilite><![CDATA[7605612]]></ASHilite>
</BtmPane>
</NodeArgs>
</Step>
<Summary sTime="29-03-2022 - 14:04:15" eTime="29-03-2022 - 14:11:36" passed="3" failed="2" warnings="1" ></Summary>
<NodeArgs eType="StartAction" icon="4" nRep="7" status="Failed" >
<Disp><![CDATA[Action1 Summary]]></Disp>
</NodeArgs>
</Action>
<NodeArgs eType="StartIteration" icon="3" nRep="6" status="Failed" >
<Disp><![CDATA[Driver Iteration 1 (Row 1)]]></Disp>
</NodeArgs>
</DIter>
<Summary sTime="29-03-2022 - 14:04:13" eTime="29-03-2022 - 14:11:36" passed="3" failed="2" warnings="1" ></Summary>
<NodeArgs eType="StartTest" icon="1" nRep="3" status="Failed" >
<Disp><![CDATA[Test Driver Summary]]></Disp>
</NodeArgs>
</Doc>
</Report>